{
  "message_id": "d1ea1b1d-1891-479c-89ac-308b5fad711e",
  "from_harness_id": "claude-code",
  "to_harness_id": "qoder",
  "lot": "C18",
  "action": "pass",
  "commit_sha": "130509b399bad0117aea22792231ce0ec54e411e",
  "base_head_sha": "58fb9195f830b0c35ba548ed29f38dc3bc067f3f",
  "evidence": { "type": "manual", "ref": "docs/PREUVES_C18.md" },
  "signature": "claude-code:pending",
  "at_utc": "2026-10-05T11:54:20Z"
}
