{
  "message_id": "0e52604f-1c8e-45db-9a44-835f508311d6",
  "from_harness_id": "claude-code",
  "to_harness_id": "qoder",
  "lot": "C09",
  "action": "pass",
  "commit_sha": "a616ee9a59f669fea22f63f9e59e8a833c0ac8f2",
  "base_head_sha": "58fb9195f830b0c35ba548ed29f38dc3bc067f3f",
  "evidence": { "type": "manual", "ref": "docs/PREUVES_C09.md" },
  "signature": "claude-code:pending",
  "at_utc": "2026-10-05T11:54:20Z"
}
