{
  "message_id": "ba5914e3-f2b2-40ad-aa8b-fd315ebcc9c4",
  "from_harness_id": "claude-code",
  "to_harness_id": "qoder",
  "lot": "C16",
  "action": "pass",
  "commit_sha": "afab4f710b96e82c036bba6c9647f0e298f3bf62",
  "base_head_sha": "58fb9195f830b0c35ba548ed29f38dc3bc067f3f",
  "evidence": { "type": "manual", "ref": "docs/PREUVES_C16.md" },
  "signature": "claude-code:pending",
  "at_utc": "2026-10-05T11:54:20Z"
}
